{
  "codigo": "P0069",
  "tipo": "MAO_OBRA",
  "descricao": "Operador de maquinas da Const Civil",
  "unidade": "mês",
  "preco_unitario": 8244.6144,
  "fonte_preco": "PLANILHA_AGIS_2026_05",
  "data_referencia_preco": "2026-05-01",
  "atributos_especificos": {
    "salario_base": 4002.24,
    "tipo_contrato": "CLT"
  }
}
