{
  "codigo": "MO-ENCARREG-AGUA",
  "tipo": "MAO_OBRA",
  "descricao": "Encarregado de Agua/Esgoto",
  "unidade": "mes",
  "preco_unitario": 4485.36,
  "fonte_preco": "negociado",
  "atributos_especificos": {
    "categoria_sindical": "horista_CE",
    "horas_extras_pct_padrao": 0.25,
    "_audit_encargos": "Removido: custo_com_encargos=9239.84 (fator=2.06). Encargos devem ser calculados via perfil.percentual_encargos (ADR-009).",
    "tipo_contrato": "CLT"
  },
  "classe_compartilhamento": {
    "classe": "concorrente_compartilhavel",
    "capacidade_cobertura": 2
  },
  "data_referencia_preco": "2025-05-01",
  "categoria": "DIVERSOS"
}
