{
  "codigo": "EQ-E0033",
  "tipo": "EQUIPAMENTO",
  "descricao": "Torre De Iluminação",
  "unidade": "h",
  "preco_unitario": 11.5,
  "fonte_preco": "catalogo_proprio",
  "atributos_especificos": {
    "codigo_planilha": "E0033",
    "valor_locacao_mensal": 2300.0,
    "horas_mes": 200,
    "consumo_litros_hora": 3.0
  },
  "classe_compartilhamento": {
    "classe": "concorrente_compartilhavel",
    "capacidade_cobertura": 5
  },
  "data_referencia_preco": "2025-05-01",
  "categoria": "DIVERSOS"
}