{
  "codigo": "EQ-CAM-BASC-14M3-ROCHAS",
  "tipo": "EQUIPAMENTO",
  "descricao": "Caminhão basculante 14 m³ - rochas",
  "unidade": "h",
  "preco_unitario": 195.2,
  "fonte_preco": "catalogo_proprio",
  "atributos_especificos": {
    "codigo_planilha": "E0004",
    "valor_locacao_mensal": 25000,
    "horas_mes": 200,
    "consumo_litros_hora": 2.5,
    "custo_locacao_hora": 125.0,
    "custo_manutencao_operacao_hora": 70.2,
    "referencia_sicro_custo_horario": "E9002",
    "metodo_custo_horario": "locacao_mais_manutencao_operacao",
    "nota": "Fator de custo 1.56x sobre locação pura. Inclui manutenção e custos operacionais conforme SICRO."
  },
  "classe_compartilhamento": {
    "classe": "exclusivo_dedicado",
    "capacidade_cobertura": 1
  },
  "data_referencia_preco": "2025-05-01",
  "categoria": "DIVERSOS"
}
