{
  "codigo": "MO-ENG-TRAINEE",
  "tipo": "MAO_OBRA",
  "descricao": "Engenheiro Trainee",
  "unidade": "mes",
  "preco_unitario": 6870.0,
  "fonte_preco": "negociado",
  "atributos_especificos": {
    "categoria_sindical": "pj_CE",
    "horas_extras_pct_padrao": 0.0,
    "metodo_custo_total": "custo_total_ja_incluido",
    "taxa_encargos_pct": 0.0,
    "nota_encargos": "Valor já representa custo total ao projeto (salário + encargos + benefícios), conforme orçamento gerencial de RH.",
    "_audit_encargos": "Removido: custo_com_encargos=6870.00 (fator=1.00). Encargos devem ser calculados via perfil.percentual_encargos (ADR-009).",
    "tipo_contrato": "CLT"
  },
  "classe_compartilhamento": {
    "classe": "concorrente_compartilhavel",
    "capacidade_cobertura": 3
  },
  "data_referencia_preco": "2025-05-01",
  "categoria": "DIVERSOS",
  "codigo_referencia_externa": "MO-P0026, P0026"
}