{
  "codigo": "P0046",
  "tipo": "MAO_OBRA",
  "descricao": "Operador de Rolo Compactador",
  "unidade": "mês",
  "preco_unitario": 6341.1744,
  "fonte_preco": "PLANILHA_AGIS_2026_05",
  "data_referencia_preco": "2026-05-01",
  "atributos_especificos": {
    "salario_base": 3078.24,
    "tipo_contrato": "CLT"
  }
}
