{
  "codigo": "P0076",
  "tipo": "MAO_OBRA",
  "descricao": "Porteiro",
  "unidade": "mes",
  "preco_unitario": 2305.6,
  "fonte_preco": "planilha_rfi_r02",
  "atributos_especificos": {
    "tipo_contrato": "CLT",
    "horas_mes": 220.0,
    "salario_base_hora": 10.48,
    "custo_hora_com_encargos_planilha": 16.9378,
    "codigo_planilha": "P0076"
  },
  "data_referencia_preco": "2026-05-08",
  "categoria": "TERRAPLENAGEM"
}