{
  "codigo": "MA-AGIS-CPU-DREN-BOCA-BSCC-200X200",
  "tipo": "MATERIAL",
  "descricao": "[AGIS-REF] BOCA BSCC 2,00 X 2,00 M - ESCONSIDADE 0° - AREIA E BRITA COMERCIAIS",
  "unidade": "un",
  "preco_unitario": 24147.536784,
  "fonte_preco": "PLANILHA_AGIS_2026_03",
  "classe_compartilhamento": {
    "classe": "exclusivo_dedicado",
    "capacidade_cobertura": 1
  },
  "data_referencia_preco": "2026-03-01",
  "categoria": "DRENAGEM"
}