{
  "codigo": "E0007",
  "tipo": "EQUIPAMENTO",
  "descricao": "Caminhão carroceria com guindauto",
  "unidade": "h",
  "preco_unitario": 150.0,
  "fonte_preco": "PLANILHA_AGIS_2026_05",
  "data_referencia_preco": "2026-05-01",
  "atributos_especificos": {
    "horas_mes": 200.0,
    "valor_locacao_mensal": 30000.0
  }
}