{
  "codigo": "M0024",
  "tipo": "MATERIAL",
  "descricao": "BSTC D=1,00m PA2 (tubo)",
  "unidade": "m",
  "preco_unitario": 299.5,
  "fonte_preco": "planilha_rfi_r02",
  "atributos_especificos": {
    "codigo_planilha": "M0024"
  },
  "data_referencia_preco": "2026-05-08",
  "categoria": "TERRAPLENAGEM"
}