{
  "codigo": "EQ-E0002",
  "tipo": "EQUIPAMENTO",
  "descricao": "Betoneira 400L",
  "unidade": "h",
  "preco_unitario": 3.45,
  "fonte_preco": "catalogo_proprio",
  "atributos_especificos": {
    "codigo_planilha": "E0002",
    "valor_locacao_mensal": 690.0,
    "horas_mes": 200,
    "consumo_litros_hora": 1.5
  },
  "classe_compartilhamento": {
    "classe": "exclusivo_dedicado",
    "capacidade_cobertura": 1
  },
  "data_referencia_preco": "2025-05-01",
  "categoria": "DIVERSOS"
}
