{
  "codigo": "P0058",
  "tipo": "MAO_OBRA",
  "descricao": "Sala Técnica",
  "unidade": "mês",
  "preco_unitario": 24720.0,
  "fonte_preco": "PLANILHA_AGIS_2026_05",
  "data_referencia_preco": "2026-05-01",
  "atributos_especificos": {
    "salario_base": 12000.0,
    "custo_com_encargos": 24720.0
  }
}