{
  "codigo": "P0008",
  "tipo": "MAO_OBRA",
  "descricao": "Auxiliar de escritorio",
  "unidade": "mês",
  "preco_unitario": 4568.256,
  "fonte_preco": "PLANILHA_AGIS_2026_05",
  "data_referencia_preco": "2026-05-01",
  "atributos_especificos": {
    "salario_base": 2217.6,
    "tipo_contrato": "CLT"
  }
}
