{
  "codigo": "EQ-E0054",
  "tipo": "EQUIPAMENTO",
  "descricao": "Trator de esteiras 24T",
  "unidade": "mes",
  "preco_unitario": 18304.0,
  "fonte_preco": "catalogo_proprio",
  "atributos_especificos": {
    "codigo_planilha": "E0054",
    "valor_locacao_mensal": 17600.0,
    "horas_mes": 200,
    "consumo_litros_hora": 20.0
  },
  "classe_compartilhamento": {
    "classe": "exclusivo_dedicado",
    "capacidade_cobertura": 1
  },
  "data_referencia_preco": "2025-05-01",
  "categoria": "DIVERSOS"
}