{
  "codigo": "SV-OUV-MO-AJUDANTE",
  "tipo": "MAO_OBRA",
  "descricao": "Ajudante",
  "unidade": "h",
  "preco_unitario": 18.24,
  "fonte_preco": "negociado",
  "atributos_especificos": {
    "categoria_sindical": "horista_CE",
    "tipo_contrato": "CLT",
    "memoria_calculo": "Planilha SUPRESSÃO SERRA VERDE / OUVIDOR-GO, agosto/2026 (composição unitária de serviço fornecida pelo cliente/fornecedor). Valor é SALÁRIO BASE (sem encargos) — encargos aplicados via pipeline (resolver_encargo/ENCARGOS_CLT), não incluídos aqui."
  },
  "classe_compartilhamento": {
    "classe": "exclusivo_dedicado",
    "capacidade_cobertura": 1
  },
  "data_referencia_preco": "2026-08-01",
  "categoria": "TERRAPLENAGEM"
}